{
  "$schema": "./compliance-rules.schema.json",
  "version": "1.0.0",
  "lastUpdated": "2026-01-12",
  "description": "Criterios de conformidade TCU/TCE para validacao automatica de ETPs. Baseado na Lei 14.133/2021, IN SEGES 58/2022, IN SEGES 65/2021 e acordaos do TCU.",
  "references": [
    {
      "id": "LEI_14133",
      "name": "Lei 14.133/2021",
      "description": "Nova Lei de Licitacoes e Contratos Administrativos",
      "url": "https://www.planalto.gov.br/ccivil_03/_ato2019-2022/2021/lei/l14133.htm"
    },
    {
      "id": "IN_SEGES_58",
      "name": "IN SEGES 58/2022",
      "description": "Regulamenta ETP Digital no ambito federal",
      "url": "https://www.gov.br/compras/pt-br/acesso-a-informacao/legislacao/instrucoes-normativas/instrucao-normativa-seges-no-58-de-8-de-agosto-de-2022"
    },
    {
      "id": "IN_SEGES_65",
      "name": "IN SEGES 65/2021",
      "description": "Procedimentos para pesquisa de precos",
      "url": "https://www.gov.br/compras/pt-br/acesso-a-informacao/legislacao/instrucoes-normativas/instrucao-normativa-seges-me-no-65-de-7-de-julho-de-2021"
    },
    {
      "id": "IN_SGD_94",
      "name": "IN SGD 94/2022",
      "description": "Contratacoes de TIC",
      "url": "https://www.gov.br/governodigital/pt-br/contratacoes/instrucao-normativa-sgd-me-no-94"
    },
    {
      "id": "LGPD",
      "name": "Lei 13.709/2018",
      "description": "Lei Geral de Protecao de Dados",
      "url": "https://www.planalto.gov.br/ccivil_03/_ato2015-2018/2018/lei/l13709.htm"
    },
    {
      "id": "ACORDAO_2622",
      "name": "Acordao TCU 2622/2013",
      "description": "Parametros de BDI para obras publicas",
      "url": "https://portal.tcu.gov.br/sumarios-e-relatorios/acordao-2622-2013-plenario/"
    },
    {
      "id": "IN_SEGES_5",
      "name": "IN SEGES 5/2017",
      "description": "Servicos continuados com dedicacao exclusiva de mao de obra",
      "url": "https://www.gov.br/compras/pt-br/acesso-a-informacao/legislacao/instrucoes-normativas"
    }
  ],
  "severityLevels": {
    "CRITICAL": {
      "weight": 1.0,
      "description": "Obrigatorio por lei - ausencia pode anular o processo",
      "color": "#dc3545"
    },
    "HIGH": {
      "weight": 0.8,
      "description": "Altamente recomendado - ausencia gera apontamento grave",
      "color": "#fd7e14"
    },
    "MEDIUM": {
      "weight": 0.5,
      "description": "Recomendado - ausencia gera apontamento moderado",
      "color": "#ffc107"
    },
    "LOW": {
      "weight": 0.2,
      "description": "Opcional - agrega valor mas nao e obrigatorio",
      "color": "#28a745"
    }
  },
  "categories": {
    "IDENTIFICATION": {
      "name": "Identificacao",
      "description": "Dados de identificacao do ETP e responsaveis",
      "order": 1
    },
    "JUSTIFICATION": {
      "name": "Justificativa",
      "description": "Descricao da necessidade e analise de alternativas",
      "order": 2
    },
    "REQUIREMENTS": {
      "name": "Requisitos",
      "description": "Especificacoes tecnicas e requisitos da contratacao",
      "order": 3
    },
    "PRICING": {
      "name": "Estimativa de Precos",
      "description": "Pesquisa de precos e estimativa de valor",
      "order": 4
    },
    "RISKS": {
      "name": "Riscos",
      "description": "Analise de riscos e medidas de mitigacao",
      "order": 5
    },
    "CONCLUSION": {
      "name": "Conclusao",
      "description": "Posicionamento conclusivo sobre viabilidade",
      "order": 6
    },
    "DOCUMENTATION": {
      "name": "Documentacao",
      "description": "Documentos complementares e anexos",
      "order": 7
    },
    "COMPLIANCE": {
      "name": "Conformidade Legal",
      "description": "Requisitos de conformidade com legislacao especifica",
      "order": 8
    }
  },
  "rules": [
    {
      "id": "TCU-001",
      "code": "REJ-001",
      "requirement": "Descricao da necessidade da contratacao",
      "description": "O ETP deve descrever claramente o problema a ser resolvido sob a perspectiva do interesse publico, com quantificacao do impacto e dados que fundamentem a necessidade.",
      "severity": "CRITICAL",
      "category": "JUSTIFICATION",
      "legalReference": "Art. 18, par. 1o, I - Lei 14.133/2021",
      "referenceIds": ["LEI_14133"],
      "applicableTypes": ["OBRAS", "TI", "SERVICOS", "MATERIAIS"],
      "etpFieldsRequired": ["justificativaContratacao", "necessidadeAtendida"],
      "sectionRequired": "justificativa",
      "keywords": ["necessidade", "demanda", "problema", "interesse publico", "motivacao"],
      "minLength": 100,
      "validationRegex": null,
      "fixSuggestion": "Descreva o problema especifico que a contratacao resolve, quantifique o impacto (custos, riscos, usuarios afetados) e demonstre o interesse publico envolvido.",
      "examples": {
        "bad": "A contratacao visa atender as necessidades operacionais do orgao.",
        "good": "O orgao atualmente opera com sistema de gestao de documentos desenvolvido em 2010, que apresenta vulnerabilidades de seguranca e indisponibilidade media de 15 horas/mes, impactando o atendimento de aproximadamente 5.000 cidadaos mensais."
      }
    },
    {
      "id": "TCU-002",
      "code": "REJ-002",
      "requirement": "Analise de alternativas de solucao",
      "description": "Levantamento de mercado com analise de pelo menos 3 alternativas de solucao, com comparativo tecnico e economico e justificativa da escolha.",
      "severity": "CRITICAL",
      "category": "JUSTIFICATION",
      "legalReference": "Art. 18, par. 1o, V - Lei 14.133/2021",
      "referenceIds": ["LEI_14133"],
      "applicableTypes": ["OBRAS", "TI", "SERVICOS", "MATERIAIS"],
      "etpFieldsRequired": ["descricaoDetalhada"],
      "sectionRequired": "requisitos",
      "keywords": ["alternativa", "solucao", "opcao", "comparativo", "viabilidade", "analise"],
      "minLength": 150,
      "validationRegex": null,
      "fixSuggestion": "Liste ao menos 3 alternativas de solucao, analise pros/contras de cada uma e justifique tecnicamente a escolha da opcao selecionada.",
      "examples": {
        "bad": "A solucao proposta e a mais adequada.",
        "good": "Foram analisadas 3 alternativas: A) Desenvolvimento interno (custo R$ 500k, prazo 18 meses); B) Aquisicao de software COTS (custo R$ 300k, prazo 6 meses); C) Contratacao SaaS (custo R$ 200k/ano, prazo 2 meses). Optou-se pela alternativa C considerando menor custo inicial e rapida implantacao."
      }
    },
    {
      "id": "TCU-003",
      "code": null,
      "requirement": "Estimativa de quantidades com memoria de calculo",
      "description": "Estimativas de quantidades para a contratacao acompanhadas de memorias de calculo e documentos que lhes dao suporte.",
      "severity": "CRITICAL",
      "category": "REQUIREMENTS",
      "legalReference": "Art. 18, par. 1o, IV - Lei 14.133/2021",
      "referenceIds": ["LEI_14133"],
      "applicableTypes": ["OBRAS", "TI", "SERVICOS", "MATERIAIS"],
      "etpFieldsRequired": ["quantidadeEstimada", "unidadeMedida"],
      "sectionRequired": "requisitos",
      "keywords": ["quantidade", "volume", "unidade", "memoria", "calculo", "estimativa"],
      "minLength": 50,
      "validationRegex": null,
      "fixSuggestion": "Detalhe as quantidades com base em levantamentos tecnicos e inclua a memoria de calculo utilizada.",
      "examples": {
        "bad": "Quantidade estimada: 100 unidades.",
        "good": "Quantidade estimada: 100 unidades. Memoria de calculo: consumo medio mensal de 8 unidades x 12 meses = 96 unidades, acrescido de 4% de margem de seguranca."
      }
    },
    {
      "id": "TCU-004",
      "code": "REJ-003",
      "requirement": "Estimativa de precos com pesquisa de mercado",
      "description": "Estimativa de valor da contratacao com pesquisa de precos em pelo menos 3 fontes, priorizando Painel de Precos, contratacoes similares e tabelas oficiais.",
      "severity": "CRITICAL",
      "category": "PRICING",
      "legalReference": "Art. 18, par. 1o, VI - Lei 14.133/2021; IN SEGES 65/2021",
      "referenceIds": ["LEI_14133", "IN_SEGES_65"],
      "applicableTypes": ["OBRAS", "TI", "SERVICOS", "MATERIAIS"],
      "etpFieldsRequired": ["fontePesquisaPrecos", "valorEstimado"],
      "sectionRequired": "custos",
      "keywords": ["preco", "valor", "estimativa", "orcamento", "pesquisa", "PNCP", "cotacao"],
      "minLength": 50,
      "validationRegex": null,
      "fixSuggestion": "Realize pesquisa de precos em minimo 3 fontes: PNCP/Painel de Precos, contratacoes similares, cotacoes de fornecedores. Utilize mediana para valor estimado.",
      "examples": {
        "bad": "Valor estimado: R$ 100.000,00 conforme cotacao do fornecedor.",
        "good": "Pesquisa de precos realizada em 4 fontes: Painel de Precos (R$ 95k), PNCP pregao 2025 (R$ 102k), Cotacao A (R$ 98k), Cotacao B (R$ 105k). Mediana: R$ 100k. Data-base: janeiro/2026."
      }
    },
    {
      "id": "TCU-005",
      "code": "REJ-004",
      "requirement": "Referencia de precos SINAPI/SICRO",
      "description": "Estimativa de valor para obras e servicos de engenharia com referencia obrigatoria a tabelas SINAPI ou SICRO, informando data-base e codigos utilizados.",
      "severity": "CRITICAL",
      "category": "PRICING",
      "legalReference": "Art. 23, Lei 14.133/2021; IN SEGES 65/2021; Acordao TCU 2622/2013",
      "referenceIds": ["LEI_14133", "IN_SEGES_65", "ACORDAO_2622"],
      "applicableTypes": ["OBRAS"],
      "etpFieldsRequired": ["fontePesquisaPrecos", "valorEstimado"],
      "sectionRequired": "custos",
      "keywords": ["SINAPI", "SICRO", "preco", "referencia", "data-base", "BDI"],
      "minLength": 50,
      "validationRegex": "(SINAPI|SICRO)",
      "fixSuggestion": "Cite obrigatoriamente SINAPI ou SICRO como referencia de precos, informando mes/ano da tabela e codigos dos servicos.",
      "examples": {
        "bad": "Valor estimado conforme cotacoes de mercado.",